<?xml version="1.0" encoding="UTF-8"?>
<tns:BookList xmlns:tns="http://www.example.org/bookstore" xmlns:xsi="http://www.w3.org/2001/XMLSchema-instance" xsi:schemaLocation="http://www.example.org/bookstore Book.xsd ">
  <tns:Book isbn="123-123-123-001-1">
    <tns:Title>The Definitive Guide to OSB</tns:Title>
    <tns:Author>Joe Bloggs</tns:Author>
    <tns:Price>39.99</tns:Price>
    <tns:FirstPublished>2001-01-01</tns:FirstPublished>
  </tns:Book>
  <tns:Book isbn="123-123-123-004-1">
  	<tns:Title>OSB For Dummies</tns:Title>
  	<tns:Author>Jane Doe</tns:Author>
  	<tns:Price>20.99</tns:Price>
  </tns:Book>
  <tns:Book isbn="123-123-123-005-1">
  	<tns:Title>Oracle SOA Suite: OSB</tns:Title>
  	<tns:Author>Larry Ellison</tns:Author>
  	<tns:Price>102.99</tns:Price>
  </tns:Book>
</tns:BookList>
