<?xml version="1.0" encoding="UTF-8"?>
<tns:BookList xmlns:tns="http://www.example.org/bookstore" xmlns:xsi="http://www.w3.org/2001/XMLSchema-instance" xsi:schemaLocation="http://www.example.org/bookstore Book.xsd ">
  <tns:Book isbn="123-123-123-001-1">
    <tns:Title>The Definitive Guide to OSB</tns:Title>
    <tns:Author>Joe Bloggs</tns:Author>
    <tns:Price>39.99</tns:Price>
    <tns:FirstPublished>2001-01-01</tns:FirstPublished>
  </tns:Book>
  <tns:Book isbn="123-123-123-002-1">
  	<tns:Title>Ultimate OSB</tns:Title>
  	<tns:Author>John Doe</tns:Author>
  	<tns:Price>35.99</tns:Price>
  </tns:Book>
  <tns:Book isbn="123-123-123-003-1">
  	<tns:Title>Learn OSB in 7 days</tns:Title>
  	<tns:Author>Joe Bloggs</tns:Author>
  	<tns:Author>John Doe</tns:Author>
  	<tns:Price>47.99</tns:Price>
  </tns:Book>
</tns:BookList>
